{
  "version": 0,
  "agents": {
    "claude": {
      "enabled": true,
      "sources": { "hooks": true, "transcripts": true, "native_metrics": true, "native_logs": true, "native_traces": true },
      "hook_events": { "denied": [] },
      "hook_fields": { "denied": [] },
      "native_content": { "denied": [] }
    },
    "codex": {
      "enabled": true,
      "sources": { "hooks": true, "transcripts": true, "native_metrics": true, "native_logs": true, "native_traces": true },
      "hook_events": { "denied": [] },
      "hook_fields": { "denied": [] },
      "native_content": { "denied": [] }
    }
  },
  "folders": { "denied": [], "allowed": [] },
  "backfill_history": false
}
