{
  "version": 12,
  "agents": {
    "claude": {
      "enabled": true,
      "sources": { "hooks": true, "transcripts": true, "native_metrics": true, "native_logs": true, "native_traces": false },
      "hook_events": { "denied": ["MessageDisplay"] },
      "hook_fields": { "denied": ["tool_response"] },
      "native_content": { "denied": ["raw_api_bodies"] }
    },
    "codex": {
      "enabled": false,
      "sources": { "hooks": true, "transcripts": true, "native_metrics": true, "native_logs": true, "native_traces": true },
      "hook_events": { "denied": [] },
      "hook_fields": { "denied": [] },
      "native_content": { "denied": [] }
    }
  },
  "folders": { "denied": ["~/work/**"], "allowed": ["~/work/oss/**"] },
  "backfill_history": true
}
